{
  "$schema": "https://json-schema.org/draft/2020-12/schema",
  "$id": "https://dsh-evolve-le.local/schemas/capsule.manifest.schema.json",
  "title": "dsh-evolve-le capsule provenance (capsule/provenance.json)",
  "description": "Self-describing provenance inside an evaluation capsule (specs/02 §12). Strictly content-addressed and timestamp-free so the capsule tar is byte-reproducible across double builds. The canonical identity (sha256 of the canonical source tar) and the SDK c_<base32> id must both appear and stay cross-bound; resume/audit must fail closed on mismatch or absence.",
  "type": "object",
  "properties": {
    "$schema": {
      "type": "string",
      "const": "https://dsh-evolve-le.local/schemas/capsule.manifest.schema.json"
    },
    "schemaVersion": {
      "type": "integer",
      "const": 1
    },
    "protocol": {
      "const": "dsh-evolve-le/capsule/v1"
    },
    "identity": {
      "type": "object",
      "properties": {
        "candidateId": {
          "$ref": "#/$defs/candidateId"
        },
        "sourceDigest": {
          "$ref": "#/$defs/sha256Ref"
        }
      },
      "required": ["candidateId", "sourceDigest"],
      "additionalProperties": false
    },
    "contents": {
      "type": "object",
      "properties": {
        "fileCount": {
          "type": "integer",
          "minimum": 1
        },
        "bytes": {
          "type": "integer",
          "minimum": 1
        },
        "sha256SumsDigest": {
          "$ref": "#/$defs/sha256Hex",
          "description": "sha256 of the capsule's own SHA256SUMS file."
        }
      },
      "required": ["fileCount", "bytes", "sha256SumsDigest"],
      "additionalProperties": false
    },
    "candidate": {
      "type": "object",
      "properties": {
        "digest": {
          "$ref": "#/$defs/sha256Hex"
        },
        "entry": {
          "type": "string",
          "pattern": "^lib/[a-z0-9/._-]+\\.js$"
        }
      },
      "required": ["digest", "entry"],
      "additionalProperties": false
    },
    "runner": {
      "type": "object",
      "properties": {
        "digest": {
          "$ref": "#/$defs/sha256Hex"
        },
        "entry": {
          "type": "string",
          "minLength": 1
        }
      },
      "required": ["digest", "entry"],
      "additionalProperties": false
    },
    "runtime": {
      "type": "object",
      "properties": {
        "kind": {
          "enum": ["pinned-closure", "install-manifest"]
        },
        "digest": {
          "$ref": "#/$defs/sha256Hex"
        },
        "detail": {
          "type": "string",
          "minLength": 1
        },
        "nativeDsh": {
          "type": "object",
          "properties": {
            "protocol": {
              "enum": [
                "dsh-evolve-le/native-dsh/v1",
                "dsh-evolve-le/native-dsh/v2",
                "dsh-evolve-le/native-dsh/v3"
              ]
            },
            "packages": {
              "type": "array",
              "items": {
                "type": "array",
                "prefixItems": [
                  {
                    "type": "string",
                    "pattern": "^@deepseek-ai/dsh-[a-z0-9-]+$"
                  },
                  {
                    "type": "string",
                    "const": "0.1.0-rc.5"
                  }
                ],
                "minItems": 2,
                "maxItems": 2,
                "items": false
              },
              "minItems": 1,
              "uniqueItems": true
            },
            "capabilities": {
              "anyOf": [
                {
                  "const": {
                    "protocol": "dsh-evolve-le/native-capabilities/v1",
                    "compaction": {
                      "auto": true,
                      "thresholdRatio": 0.8,
                      "retainRatio": 0.16,
                      "maxTokens": 8192,
                      "compactionRetries": 0,
                      "maxOverflowRetries": 1
                    },
                    "subagents": {
                      "maxDepth": 1,
                      "maxChildren": 4,
                      "maxConcurrent": 2,
                      "maxSteps": 32,
                      "background": false
                    }
                  }
                },
                {
                  "const": {
                    "protocol": "dsh-evolve-le/native-capabilities/v2",
                    "compaction": {
                      "auto": true,
                      "thresholdRatio": 0.8,
                      "retainRatio": 0.16,
                      "maxTokens": 8192,
                      "compactionRetries": 0,
                      "maxOverflowRetries": 1
                    },
                    "subagents": {
                      "maxDepth": 1,
                      "maxChildren": 4,
                      "maxConcurrent": 2,
                      "maxSteps": 32,
                      "background": false
                    },
                    "events": {
                      "protocol": "dsh-evolve-le/candidate-events/v2",
                      "maxPending": 256,
                      "maxCheckpointsPerStep": 64
                    }
                  }
                }
              ]
            }
          },
          "required": ["protocol", "packages"],
          "additionalProperties": false,
          "allOf": [
            {
              "if": {
                "properties": {
                  "protocol": {
                    "const": "dsh-evolve-le/native-dsh/v2"
                  }
                },
                "required": ["protocol"]
              },
              "then": {
                "required": ["capabilities"],
                "properties": {
                  "capabilities": {
                    "const": {
                      "protocol": "dsh-evolve-le/native-capabilities/v1",
                      "compaction": {
                        "auto": true,
                        "thresholdRatio": 0.8,
                        "retainRatio": 0.16,
                        "maxTokens": 8192,
                        "compactionRetries": 0,
                        "maxOverflowRetries": 1
                      },
                      "subagents": {
                        "maxDepth": 1,
                        "maxChildren": 4,
                        "maxConcurrent": 2,
                        "maxSteps": 32,
                        "background": false
                      }
                    }
                  }
                }
              }
            },
            {
              "if": {
                "properties": {
                  "protocol": {
                    "const": "dsh-evolve-le/native-dsh/v3"
                  }
                },
                "required": ["protocol"]
              },
              "then": {
                "required": ["capabilities"],
                "properties": {
                  "capabilities": {
                    "const": {
                      "protocol": "dsh-evolve-le/native-capabilities/v2",
                      "compaction": {
                        "auto": true,
                        "thresholdRatio": 0.8,
                        "retainRatio": 0.16,
                        "maxTokens": 8192,
                        "compactionRetries": 0,
                        "maxOverflowRetries": 1
                      },
                      "subagents": {
                        "maxDepth": 1,
                        "maxChildren": 4,
                        "maxConcurrent": 2,
                        "maxSteps": 32,
                        "background": false
                      },
                      "events": {
                        "protocol": "dsh-evolve-le/candidate-events/v2",
                        "maxPending": 256,
                        "maxCheckpointsPerStep": 64
                      }
                    }
                  }
                }
              }
            }
          ]
        },
        "nodeRuntime": {
          "type": "object",
          "description": "The pinned node interpreter embedded at runtime/node and exec'd by the ACP entrypoint. TB task images ship no node, so the capsule carries its own (specs/02 §12). Optional only because pre-Gate-8-fix capsules predate it; every capsule built after dsh-evolve-le-builder-0.0.2 records it.",
          "properties": {
            "version": {
              "type": "string",
              "pattern": "^v[0-9]+\\.[0-9]+\\.[0-9]+$"
            },
            "path": {
              "const": "runtime/node"
            },
            "sha256": {
              "$ref": "#/$defs/sha256Hex"
            }
          },
          "required": ["version", "path", "sha256"],
          "additionalProperties": false
        }
      },
      "required": ["kind", "digest", "detail"],
      "additionalProperties": false
    },
    "sbom": {
      "type": "object",
      "properties": {
        "path": {
          "const": "sbom.spdx.json"
        },
        "sha256": {
          "$ref": "#/$defs/sha256Hex"
        }
      },
      "required": ["path", "sha256"],
      "additionalProperties": false
    }
  },
  "required": [
    "$schema",
    "schemaVersion",
    "protocol",
    "identity",
    "contents",
    "candidate",
    "runner",
    "runtime",
    "sbom"
  ],
  "additionalProperties": false,
  "$defs": {
    "sha256Hex": {
      "type": "string",
      "pattern": "^[0-9a-f]{64}$"
    },
    "sha256Ref": {
      "type": "string",
      "pattern": "^sha256:[0-9a-f]{64}$"
    },
    "candidateId": {
      "type": "string",
      "pattern": "^c_[a-z2-7]{26}$"
    }
  }
}
